title,URL,total_time,description,ingredients,instructions,calories,serves
Pandan Chiffon Cake,https://www.allrecipes.com/recipe/266245/pandan-chiffon-cake/,60,"Pandan cake is a soft, fluffy chiffon cake flavored with South East Asian pandan paste for a bright green color and sweet floral notes.","['6 eggs - separated', '0.25 teaspoon cream of tartar', '0.5 cup white sugar', '8 tablespoons water', '0.25 teaspoon pandan paste', '5 tablespoons corn oil', '1 cup self-rising flour - sifted']","['Preheat the oven to 325 degrees F (165 degrees C).', 'Combine egg whites and cream of tartar in the bowl of a stand mixer fitted with the whisk attachment; beat egg whites until stiff peaks form.', 'Beat egg yolks and sugar in a separate bowl until sugar has dissolved.', 'Whisk water and pandan paste until smooth; mix thoroughly into egg yolk mixture. Stir in corn oil, then fold in sifted flour.', 'Fold egg yolk mixture gently into beaten egg whites using a spatula. Pour into a 9-inch chiffon cake mold.', 'Bake in the preheated oven until a toothpick inserted into the center comes out clean, 45 to 50 minutes. Invert cake mold onto a cooling rack immediately after removing it from the oven. Let cake cool upside down in the mold. Loosen cooled cake from the mold using a sharp knife.']",227 kcal,8 servings
How to Make Beef Satay,https://www.allrecipes.com/recipe/234309/how-to-make-beef-satay/,150,"This beef satay recipe is Chef John's version of the popular Thai Malaysian appetizer of grilled sirloin strips flavored with sweet, zesty marinade.","['0.25 cup packed brown sugar', '0.25 cup fish sauce', '4 cloves crushed garlic', '2 tablespoons minced onion', '2 tablespoons vegetable oil', '2 tablespoons soy sauce', '2 tablespoons ground coriander', '1 tablespoon grated fresh ginger root', '1 tablespoon ground cumin', '0.5 teaspoon ground turmeric', '0.125 teaspoon cayenne pepper', '2-inch piece of fresh lemon grass (white part only)', '2 pounds beef top sirloin - trimmed', '4 12-inch long metal skewers']","['Whisk together brown sugar, fish sauce, garlic, onion, oil, soy sauce, coriander, ginger, cumin, turmeric, and cayenne pepper in a mixing bowl until smooth.', ""Bruise lemongrass by hitting it lightly several times with the back of a large chef's knife; mince lemongrass and add to marinade."", 'Cut beef sirloin into strips about 2 1/2-inches long and 1/8 inch-thick. Stir beef into marinade until beef is completely coated, about 1 minute. Cover the bowl with plastic wrap and marinate in the refrigerator for 2 to 4 hours.', 'Preheat an outdoor grill for high heat. Lightly oil the grate.', 'Remove beef from marinade and shake off excess marinade. Thread 1/4 of the meat onto each metal skewer. Discard remaining marinade.', 'Arrange skewers on the preheated grill; cook until meat stops sticking to the grill, 1 to 2 minutes. Flip skewers and continue cooking until meat is well browned and shows grill marks, 2 to 2 1/2 minutes. Flip skewers once more; cook until meat is still slightly pink, about 2 minutes. Transfer skewers to a platter; let rest for 2 minutes before serving.']",484 kcal,4 servings
Ayam Penyet Pedas (Indonesian Spicy Penyet Chicken),https://www.allrecipes.com/recipe/264557/ayam-penyet-pedas-indonesian-spicy-penyet-chicken/,120,Ayam Penyet (Penyet Chicken) is an incredibly spicy Indonesian dish that is not for the faint-hearted. Ingredients can be found in Asian grocery stores.,"['5 cloves garlic (peeled divided)', '3 shallots (divided)', '1.5 inch piece fresh ginger root (peeled and chopped)', '1.5 inch piece galangal (thinly sliced)', '0.5 teaspoon ground coriander', '2 teaspoons salt (divided)', '4 chicken thighs', '1.25 cups water', '2 salam leaves (substitute with curry leaves)', '3 teaspoons oil (divided) (or as needed)', '0.5 tomato', '11 fresh red chile pepper (finely chopped)', '4 tablespoons key lime juice', '1 teaspoon shrimp paste', '0.5 teaspoon white sugar', '1 bunch lemon basil (kemangi)']","['Combine garlic, 1 shallot, ginger, galangal, coriander, and 1.5 teaspoon salt in a mortar and pestle; pound into a paste.', 'Combine chicken with the garlic paste, water, and salam leaves in a pot. Bring to a boil, reduce heat, and simmer until chicken is cooked through, about 20 minutes.', ""Meanwhile, heat 2 teaspoons oil in a skillet. Once the chicken is fully boiled, fry the chicken in the skillet until it's golden brown, 5 to 10 minutes."", 'For the sambal (chili sauce) heat 1 teaspoon oil in a skillet over medium heat and cook remaining 2 shallots, tomato, and red chiles for 2 minutes. Move to a mortar and pestle and add lime juice, shrimp paste, 1/2 teaspoon salt, sugar, and lemon basil. Pound everything into a paste.', 'Place the sambal (chile sauce) at the bottom of a serving plate and place the chicken on top of the dish.']",558 kcal,2 servings
Indonesian Satay,https://www.allrecipes.com/recipe/36875/indonesian-satay/,60,"Boneless chicken meat is marinated in a soy sauce mixture, cooked on the grill, and served with a delicious peanut sauce.","['3 tablespoons soy sauce', '3 tablespoons tomato sauce', '1 tablespoon peanut oil', '2 cloves garlic (peeled and minced)', '1 pinch ground black pepper', '1 pinch ground cumin', '6 pcs skinless boneless chicken breast halves - cubed', '1 tablespoon vegetable oil', '0.25 cup minced onion', '1 clove garlic (peeled and minced)', '1 cup water', '0.5 cup chunky peanut butter', '2 tablespoons soy sauce', '2 tablespoons white sugar', '1 tablespoon lemon juice', 'some skewers']","['In a bowl, mix soy sauce, tomato sauce, peanut oil, garlic, black pepper, and cumin. Place chicken into the mixture, and stir to coat. Cover, and marinate in the refrigerator for at least 15 minutes, but not overnight. This will make the meat too dark.', 'Preheat the grill for high heat.', 'Heat vegetable oil in a saucepan over medium heat, and saute onion and garlic until lightly browned. Mix in water, peanut butter, soy sauce, and sugar. Cook and stir until well blended. Remove from heat, mix in lemon juice, and set aside.', 'Lightly oil the grill grate. Thread chicken onto skewers, and discard marinade. Grill skewers about 5 minutes per side, until chicken juices run clear. Serve with the peanut sauce.']",329 kcal,6 servings
Spicy Tomato Chicken (Ayam Masak Merah),https://www.allrecipes.com/recipe/156939/spicy-tomato-chicken-ayam-masak-merah/,55,"Chicken is simmered in a fragrant sauce of chile peppers, turmeric, cinnamon, star anise, cloves, and cardamom.","['3 pound whole chicken (cut into 8 pieces)', '1 teaspoon ground turmeric', 'some pinched of salt', '0.25 cup dried red chile peppers', '3 fresh red chile pepper (finely chopped)', '4 cloves garlic, minced', '1 red onion (chopped)', '1 (3/4 inch thick slice fresh ginger root', '2 tablespoons sunflower seed oil', '1 cinnamon stick', '2 whole star anise pods', '5 whole cloves', '5 cardamom seeds', '2 tomatoes (sliced)', '2 tablespoons ketchup', '1 teaspoon white sugar', '0.5 cup water']","['Rub the chicken with turmeric powder and salt. Set aside. Soak the dried red chile peppers in hot water until softened. Blend the softened dried chile, fresh red chile pepper, garlic, onion, and ginger in a blender to a paste.', 'Heat the oil in a large skillet over medium-high heat. Brown the chicken in the hot oil until golden on all sides. Remove the chicken from the skillet and set aside. Remove excess oil from the skillet, leaving about 1 tablespoon. Cook and stir the chile paste with the cinnamon, star anise, cloves and cardamom seeds until fragrant. Return the chicken to the skillet. Stir in the water, adding more if needed. Toss in the tomatoes and stir in the ketchup and sugar. Bring to a boil then reduce heat to medium-low and simmer until no the chicken longer pink at the bone and the juices run clear, about 15 minutes. Serve hot.']",462 kcal,4 servings
Chef John's Beef Rendang,https://www.allrecipes.com/recipe/270313/chef-johns-beef-rendang/,270,"Galangal, peppers, coconut milk, lemongrass, and lots of spices are simmered with beef chuck to make the dry, concentrated Indonesian curry known as beef rendang.","['2.5 pounds beef chuck', '4 shallots (sliced)', '6 cloves garlic', '1 (1.5 inch piece ginger (peeled and sliced)', '1.5 inch piece galangal (peeled and sliced)', '2 serrano chile peppers - stemmed, seeded, and sliced', '1 Fresno chile pepper - stemmed, seeded, and sliced', '1 tablespoon Korean red pepper flakes', '1 teaspoon ground coriander', '0.5 teaspoon ground turmeric', '0.125 teaspoon ground cardamom', '0.125 teaspoon freshly grated nutmeg', '2 tablespoons vegetable oil', '14 ounce can full-fat coconut milk', '2 teaspoons tamarind paste', '1 tablespoon brown sugar', '0.5 stalk lemongrass, light part']","['Cut beef chuck into 2-inch pieces.', 'Combine shallots, garlic, ginger, galangal, serrano and Fresno chiles, salt, red pepper flakes, coriander, turmeric, cardamom, and nutmeg in the bowl of a food processor. Pulse until paste is very finely ground, stopping occasionally to scrape down the sides with a spatula.', 'Heat oil in a pan over medium heat. Add the curry paste. Cook and stir until it starts to dry out, then stir in the beef. Add coconut milk, tamarind paste, and brown sugar. Stir to combine. Fill up the empty can of coconut milk with water and pour it into the pan. Increase heat to medium-high; bring to a simmer.', 'In the meantime, bruise lemongrass with the back of your knife. Cut into 1- to 2-inch pieces and add to the curry. Reduce heat to medium. Cook, uncovered, stirring occasionally, until beef is fork-tender and sauce is fully reduced, about 4 hours. Stir more frequently as water reduces; add more water or lower the heat if sauce is reducing faster than beef is softening.', 'Remove lemongrass to serve. For best results, let cool and serve the next day.']",380 kcal,8 servings
Nasi Goreng (Indonesian Fried Rice),https://www.allrecipes.com/recipe/165963/indonesian-fried-rice-nasi-goreng/,180,"Nasi goreng is a traditional Indonesian fried rice dish that's savory, sweet, and salty thanks to the addition of kecap manis (Indonesian soy sauce).","['cooking spray', '3 large eggs, beaten', '1 tablespoon vegetable oil', '1 onion (chopped)', '1 leek (chopped)', '2 green chile peppers (chopped)', '1 clove garlic, minced', '0.5 pound skinless, boneless chicken breasts, cut into thin strips', '0.5 pound prawns(peeled and deveined))', '1 teaspoon ground coriander', '1 teaspoon ground cumin', '1 cup uncooked white rice', '3 tablespoons sweet soy sauce (Indonesian kecap manis)']","['Heat a large nonstick skillet over medium heat. Coat with nonstick cooking spray.', 'Pour eggs into the hot skillet and cook until the edges begin to set. Lift the edges to allow any uncooked egg to flow onto the hot pan, about 1 minute. Flip omelet in one piece and cook until fully set, about 30 seconds. Transfer omelet to a cutting board and slice into 1/2-inch strips. Set aside.', 'Heat vegetable oil in a wok or large frying pan over high heat. Stir in onion, leek, chile peppers, and garlic. Cook and stir until onion is soft, 3 to 5 minutes. Stir in chicken, shrimp, coriander, and cumin; mix well. Cook and stir for about 5 minutes.', 'Mix in cooked rice, sweet soy sauce, and omelet strips; cook until rice is heated through and chicken is no longer pink in the center, 3 to 5 minutes.']",415 kcal,4 servings
Pisang Goreng (Indonesian Banana Fritters),https://www.allrecipes.com/recipe/47104/pisang-goreng-indonesian-banana-fritters/,20,Banana slices are coated in a tasty batter and deep-fried in this pisang goreng recipe for the popular Indonesian snack.,"['1.25 cups all-purpose flour', '2 tablespoons granulated sugar', '0.25 tablespoon vanilla powder', '0.5 cup milk', '1 egg', '2 tablespoons butter, melted', '1 teaspoon rum flavoring', '4 ripe bananas (sliced)', '2 cups oil for frying']","['Combine flour, sugar, and vanilla powder in a large bowl; make a well in the center. Pour milk, egg, melted butter, and rum flavoring into the well; mix until smooth. Fold in banana slices until evenly coated.', 'Heat oil in a wok or deep fryer to 375 degrees F (190 degrees C).', 'Drop banana mixture by tablespoon into hot oil. Fry in hot oil until golden brown and crispy, 10 to 15 minutes. Remove bananas from oil and drain them on paper towels. Serve hot.']",489 kcal,4 servings
Kecap Manis (Sweet Soy Sauce),https://www.allrecipes.com/recipe/178280/kecap-manis-sweet-soy-sauce/,145,"A thick and sweet sauce made with dark soy sauce, sugar, garlic, curry leaves, ginger, and star anise. Use it with all of your Asian cuisine!","['2.5 cups white sugar', '3 cups dark soy sauce', '0.5 cup water', '0.5 star anise pod', '2 fresh curry leaves', '1 inch piece fresh ginger root (sliced)', '4 cloves garlic, minced']","['Heat sugar in a heavy saucepan over medium-low heat until sugar becomes lightly brown. Slowly stir in soy sauce. Once the sugar and soy sauce are combined, stir in the water, star anise, curry leaves, ginger, and garlic. Increase heat and bring to a boil. Simmer until the sugar is dissolved, about 15 minutes. Remove from heat and cool. Strain sauce and pour into a lidded bottle or jar. Store in the refrigerator.']",65 kcal,30 servings
Indonesian Chicken Skewers with Peanut Sauce (Satay Ayam),https://www.allrecipes.com/recipe/221322/indonesian-chicken-skewers-with-peanut-sauce-satay-ayam/,100,Satay ayam is a sweet and salty Indonesian peanut sauce. Serve with pan-fried or grilled chicken skewers for an irresistible summer appetizer.,"['1 pound chicken thighs, cut into 1/2-inch pieces', '0.75 teaspoon salt', '1 pinch ground white pepper', '1 tablespoon sunflower seed oil', '24 wooden skewers', '1 cup water', '5 tablespoons peanut butter', '2 tablespoons kecap manis (sweet soy sauce)', '1 tablespoon brown sugar', '2 cloves garlic, minced', '0.5 teaspoon salt', '1 tablespoon lime juice']","['Combine chicken thighs, 3/4 teaspoon salt, white pepper, and sunflower seed oil in a bowl. Cover and refrigerate for 1 to 2 hours.', 'Soak wooden skewers in water to prevent burning during cooking.', 'Bring water, peanut butter, kecap manis, brown sugar, garlic, and 1/2 teaspoon salt to a boil in a small saucepan; stir to combine. Remove from heat and add lime juice; transfer peanut sauce into a bowl.', 'Thread marinated chicken onto skewers; brush 2 tablespoons of peanut sauce over chicken skewers.', 'Heat a grill pan or large skillet over medium-high heat. Arrange chicken skewers in batches on the grill pan and cook until chicken is no longer pink in the center, 1 to 2 minutes per side. Serve skewers with remaining peanut sauce.']",326 kcal,4 servings
Mie Goreng - Indonesian Fried Noodles,https://www.allrecipes.com/recipe/169870/mie-goreng-indonesian-fried-noodles/,35,"Chicken breast, cabbage, carrots, broccoli and mushrooms are stir-fried in a wok with cooked ramen noodles and sweet soy sauce to make a beloved home-style Indonesian noodle dish.","['3 (3 ounce packages ramen noodles (without flavor packets)', '1 tablespoon vegetable oil', '1 pound skinless, boneless chicken breast halves, cut into strips', '1 teaspoon olive oil', '1 teaspoon garlic salt', '1 pinch ground black pepper', '1 tablespoon vegetable oil', '0.5 cup chopped shallots', '5 cloves garlic (chopped)', '1 cup shredded cabbage', '1 cup shredded carrots', '1 cup broccoli florets', '1 cup sliced fresh mushrooms', '0.25 cup soy sauce', '0.25 cup sweet soy sauce (Indonesian kecap manis)', '0.25 cup oyster sauce', 'some pinched of salt and pepper']","['Bring a pan of water to a boil, and cook the ramen until tender, about 3 minutes. Plunge the noodles into cold water to stop the cooking, drain in a colander set in the sink, and drizzle the noodles with 1 tablespoon of vegetable oil. Set aside.', 'Place the chicken strips in a bowl, and toss with olive oil, garlic salt, and black pepper. Heat 1 tablespoon of oil in a wok over high heat, and cook and stir the chicken until it is no longer pink, about 5 minutes. Stir in the shallots and garlic, and cook and stir until they start to turn brown. Add the cabbage, carrots, broccoli, and mushrooms, and cook and stir until the vegetables are tender, about 5 minutes.', 'Stir in the ramen noodles, soy sauce, sweet soy sauce, and oyster sauce, mixing the noodles and sauces into the vegetables and chicken. Bring the mixture to a simmer, sprinkle with salt and pepper, and serve hot.']",356 kcal,6 servings
Chicken In Coconut Sauce,https://www.allrecipes.com/recipe/74975/chicken-in-coconut-sauce/,60,"An Indonesian-inspired coconut sauce for chicken made with cream of coconut, garlic, onions, and spices. Serve over hot cooked rice for a great-tasting meal.","['15 ounce can cream of coconut', '1 cup hot water', '3 tablespoons vegetable oil', '4 skinless, boneless chicken breast halves', '1 tablespoon lemon juice', '1 teaspoon ground ginger', '1 teaspoon chili powder', 'some pinched of salt and pepper', '2 onions (chopped)', '3 cloves garlic (peeled and crushed)']","['Mix cream of coconut with hot water until smooth and well blended; set aside.', 'Heat oil in a large skillet over medium-high heat; place chicken breasts into hot oil and fry until golden brown but still pink inside, about 5 minutes per side. Transfer chicken breasts to a paper towel-lined plate; sprinkle with lemon juice, ginger, chili powder, salt, and pepper.', 'Place onions and garlic into the skillet over medium heat; cook and stir until soft and translucent, about 5 minutes. Return chicken breasts to the skillet on top of cooked onions and garlic; pour coconut cream mixture over chicken. Reduce heat to medium-low; simmer until chicken is cooked through and sauce has thickened, about 35 minutes.']",716 kcal,4 servings
Cap Cai,https://www.allrecipes.com/recipe/166608/cap-cai/,45,"Learn how to make cap cai. Shrimp, broccoli, cauliflower, and other vegetables are simmered with oyster sauce in this tasty Indonesian dish.","['3 tablespoons vegetable oil', '4 cloves garlic, minced', '1 onion (thinly sliced)', '10 ounces medium shrimp(peeled and deveined))', '1 head bok choy (chopped)', '1.5 cups chopped broccoli', '1.5 cups chopped cauliflower', '1 large carrot - thinly sliced at an angle', '3 green onions (chopped)', '0.66666668653488 cup water', '2 tablespoons cornstarch', '2 tablespoons fish sauce', '2 tablespoons oyster sauce', '1 teaspoon white sugar', '0.5 teaspoon ground black pepper', 'some pinched of salt']","['Heat vegetable oil in a large saucepan over medium heat. Stir in garlic and onion; cook and stir until onion has softened and turned translucent, about 5 minutes. Add shrimp, bok choy, broccoli, cauliflower, carrot, and green onion. Pour in water, cover, and cook until shrimp is no longer translucent in the center and vegetables are tender, about 15 minutes.', 'Dissolve cornstarch into fish sauce in a small bowl. Stir into the cap cai along with oyster sauce, sugar, and pepper; stir until thickened. Season with salt before serving.']",250 kcal,4 servings
Indonesian Spiced Rice,https://www.allrecipes.com/recipe/18307/indonesian-spiced-rice/,45,"This colorful, spicy rice side dish is flavored with garlic, turmeric, cinnamon, and jalapeños. Pairs perfectly with lamb kabobs.","['3 tablespoons vegetable oil', '1 large onion (chopped)', '2 jalapeno peppers, seeded and minced', '2 cloves garlic, crushed', '1 teaspoon ground turmeric', '0.5 teaspoon ground cinnamon', '2 cups uncooked long-grain white rice', '14.5 ounce cans chicken broth', '1 cup water', '1 bay leaf', '2 green onions (chopped)']","['Heat oil in a large, heavy pan over medium heat. Stir in onion, jalapeños, and garlic. Sauté until onion is translucent; about 6 to 8 minutes.', 'Stir in turmeric and cinnamon. Add rice; cook and stir for 2 minutes. Mix in chicken broth, water, and bay leaf; bring to a boil. Reduce heat to low, cover, and cook for 20 minutes.', 'Turn off the heat and let sit for 5 minutes. Garnish with chopped green onion.']",226 kcal,8 servings
Sop Buntut (Indonesian Oxtail Soup),https://www.allrecipes.com/recipe/246144/sop-buntot-indonesian-oxtail-soup/,375,Oxtail and vegetables are simmered for hours into a deeply comforting soup with complex flavors in this recipe for Indonesian sop buntut.,"['4 shallots (peeled and halved)', '1 large onion, quartered (divided)', '2 inch piece ginger (peeled and thinly sliced across the grain)', '5 cloves garlic (peeled)', '3 tablespoons canola oil', '6 whole cloves', '0.5 teaspoon ground nutmeg', '0.25 teaspoon ground cinnamon', '4 pounds meaty oxtail pieces, at room temperature', '3 stalks celery, cut into 1-inch pieces', '2 large carrots, cut into 2-inch pieces (divided)', '4 cups water (or as needed) to cover', '3 waxy potatoes, scrubbed and cut into 1.5-inch chunks', '3 large carrots, cut into 2-inch pieces', '2 teaspoons salt', '0.5 teaspoon ground black pepper', '2 tablespoons white sugar', '2 tablespoons fish sauce', '3 ripe roma tomatoes (sliced) horizontally into 1/2-inch wedges', '2.8 ounce can French-fried onions']","['Combine shallots, 2 onion quarters, ginger, and garlic in a food processor; pulse into a paste.', 'Heat oil in a large pot over medium-high heat; cook and stir cloves, nutmeg, and cinnamon until fragrant, about 30 seconds. Add shallot paste and fry until fragrant and slightly browned, 2 to 3 minutes. Add oxtails; cook and stir until browned, about 5 minutes.', 'Stir remaining onion quarters, celery, and 2 carrots into the pot. Pour in enough water to cover by 2 inches. Bring to a boil; reduce heat, cover, and simmer until oxtail is tender, about 5 hours.', 'Stir potatoes, 3 carrots, salt, and black pepper into the pot. Increase heat and simmer soup until potatoes and carrots are tender, about 15 minutes. Add sugar and fish sauce; stir well to combine.', 'Ladle soup into large serving bowls; top with tomato wedges and French-fried onions.']",520 kcal,8 servings
Jemput Jumput (Banana Fritters),https://www.allrecipes.com/recipe/85508/jemput-jumput-banana-fritters/,25,A touch of sugar adds an extra flavor dimension in this traditional Indonesian fritter. It's a delicious and fun family treat.,"['0.625 cup all-purpose flour', '1 pinch salt', '1 teaspoon baking powder', '6 ripe bananas', '3 tablespoons white sugar', 'oil for frying']","['Heat oil in a deep fryer or heavy bottomed pan to 375 degrees F (190 degrees C).', 'Sift the flour, salt, and baking powder into a medium bowl.', 'In a separate bowl, mash together the bananas and sugar. Gradually mix flour mixture into mashed bananas, stirring until well combined.', 'Drop batter by spoonfuls into hot oil, and cook, turning once, until browned, 2 to 8 minutes. Drain on paper towels.']",491 kcal,18 servings
Erin's Indonesian Chicken,https://www.allrecipes.com/recipe/78131/erins-indonesian-chicken/,45,Chicken and green beans are served over rice with a spicy peanut sauce.,"['1 cup uncooked long grain white rice', '2 cups water', '1 pound fresh green beans (trimmed and snapped)', '2 teaspoons olive oil', '1 pound skinless, boneless chicken breast halves - cut into chunks', '0.75 cup low-sodium chicken broth', '0.35 cup smooth peanut butter', '2 teaspoons honey', '1 tablespoon low sodium soy sauce', '1 teaspoon red chile paste', '2 tablespoons lemon juice', '3 green onions (thinly sliced)', '2 tablespoons chopped peanuts']","['Bring the rice and water to boil in a pot. Reduce heat to low, cover, and simmer 20 minutes.', 'Place green beans in a pot fitted with a steamer basket over boiling water, and steam 10 minutes, or until tender but crisp.', 'Heat the oil in a skillet, and cook the chicken 5 minutes on each side, or until juices run clear.', 'Mix the chicken broth, peanut butter, honey, soy sauce, chile paste, lemon juice in a saucepan over medium heat. Cook and stir 5 minutes, until slightly thickened. Mix in the green beans. Serve over rice. Garnish with green onions and peanuts.']",530 kcal,4 servings
Indonesian Pork Satay,https://www.allrecipes.com/recipe/21230/indonesian-pork-satay/,400,"For a Southeast Asian treat, try these grilled pork skewers, marinated in a spicy ginger-peanut sauce.","['2 cloves garlic', '0.5 cup chopped green onions', '1 tablespoon chopped fresh ginger root', '1 cup roasted, salted Spanish peanuts', '2 tablespoons lemon juice', '2 tablespoons honey', '0.5 cup soy sauce', '2 teaspoons crushed coriander seed', '1 teaspoon red pepper flakes', '0.5 cup chicken broth', '0.5 cup melted butter', '1.5 pounds pork tenderloin, cut into 1 inch cubes', 'skewers']","['In a food processor, process garlic, green onions, ginger, peanuts, lemon juice, honey, soy sauce, coriander, and red pepper flakes. Puree until almost smooth. Pour in broth and butter, and mix again.', 'Place pork cubes in a large resealable plastic bag, and pour mixture over meat. Marinate in the refrigerator for 6 hours, or overnight.', 'Preheat grill for medium heat. Remove pork cubes from bag, and thread onto skewers. In a small saucepan, boil the marinade for 5 minutes. Reserve a small amount of the marinade for basting, and set the remainder aside to serve as a dipping sauce.', 'Lightly oil preheated grill. Grill for 10 to 15 minutes, or until well browned, turning and brushing frequently with cooked marinade. Serve with dipping sauce.']",682 kcal,4 servings
