title,URL,total_time,description,ingredients,instructions,calories,serves
Quick and Easy Kimchi Salad,https://www.allrecipes.com/recipe/246247/quick-and-easy-kimchi-salad/,55,"Cabbage and carrots get a quick brine, then a dressing of sesame, vinegar, cayenne, and sugar for great kimchi flavor without the wait.","['1 small head cabbage - shredded', '0.25 cup rock salt', '1 small carrot, cut into thin strips', '3 tablespoons vinegar', '2 tablespoons vegetable oil', '1 tablespoon white sugar', '1 teaspoon sesame oil', '1 teaspoon toasted sesame seeds, ground', '0.5 teaspoon cayenne pepper', '0.25 teaspoon salt']","['Combine cabbage and rock salt together in a bowl. Let stand 15 minutes, stirring often. Rinse lightly and drain.', 'Mix cabbage, carrot, vinegar, vegetable oil, sugar, sesame oil, sesame seeds, cayenne pepper, and salt together in a bowl. Refrigerate until chilled, at least 30 minutes.']",92 kcal,6 servings
Spicy Korean Fried Chicken with Gochujang Sauce,https://www.allrecipes.com/recipe/273786/spicy-korean-fried-chicken-with-gochujang-sauce/,40,Extra-crispy Korean fried chicken is served with a sweet and spicy gochujang sauce for an Asian-inspired meal that's packed with flavor.,"['0.35 cup milk', '1 egg', '1 pound chicken breast tenderloins', '0.25 cup all-purpose flour', '0.25 cup potato starch', '0.5 teaspoon salt', '0.25 teaspoon ground black pepper', 'some liters vegetable oil for frying', '0.25 cup honey', '0.25 cup brown sugar', '2 tablespoons soy sauce', '2 tablespoons gochujang (Korean hot pepper paste)', '1 tablespoon Worcestershire sauce', '2 teaspoons red pepper flakes', '1 teaspoon ground ginger']","['Whisk milk and egg together in a large bowl until thoroughly combined and smooth. Add chicken tenders to egg wash and let marinate in the refrigerator for 15 minutes.', 'Combine flour, potato starch, salt, and pepper in a large mixing bowl. Pour mixture into a large, resealable plastic bag. Drain and discard marinade from chicken tenders. Add chicken to the bag, seal it, and shake until each piece is completely dredged in mixture.', 'Heat oil in a deep-fryer or large saucepan to 325 degrees F (165 degrees C).', 'Add chicken pieces to the hot oil about 5 pieces at a time so as not to drop the temperature of the oil. Fry for 2 minutes. Transfer chicken to a plate lined with paper towels to drain. Continue with remaining chicken pieces.', 'Increase oil heat to 350 degrees F (175 degrees C) until continuously boiling. Carefully add the first batch of cooked chicken and fry again until cooked through and crispy about 2 minutes more. Transfer to a plate lined with paper towels to drain. Repeat with the second batch of chicken pieces. Transfer chicken to a medium-sized serving bowl.', 'Heat a small saucepan over medium-low heat. Add honey, brown sugar, soy sauce, gochujang paste, Worcestershire sauce, red pepper flakes, and ginger. Cook and stir continuously until sugar has melted and sauce is smooth, about 5 minutes. Drizzle sauce over twice-fried chicken tenders and serve.']",398 kcal,4 servings
Korean Spicy Marinated Pork (Dae Ji Bool Gogi),https://www.allrecipes.com/recipe/162036/korean-spicy-marinated-pork-dae-ji-bool-gogi/,240,"This spicy Korean pork is very good served with rice, kimchi, and salad.","['0.25 cup rice wine vinegar', '2 tablespoons soy sauce', '0.5 cup gochujang (Korean hot pepper paste)', '3 tablespoons minced garlic', '3 tablespoons minced fresh ginger root', '2 tablespoons red pepper flakes', '0.5 teaspoon black pepper', '3 tablespoons white sugar', '3 green onions, cut into 2 inch pieces', '0.5 yellow onion, cut into 1/4-inch thick rings', '2 pound pork loin, cut into 1/4 inch slices', '0.25 cup canola oil']","['Stir together the vinegar, soy sauce, hot pepper paste, garlic, ginger, red pepper flakes, black pepper, sugar, green onions, and yellow onion in a large bowl. Mix in the pork slices, mixing well until completely coated. Place into a resealable plastic bag, squeeze out any excess air, seal, and marinate in the refrigerator at least 3 hours.', 'Heat the canola oil in a large skillet over medium-high heat. Add the pork slices in batches, and cook until no longer pink in the center, and lightly browned on the outside, about 5 minutes per batch. Be careful when cooking the meat, the spicy fumes will hurt your nose!']",300 kcal,8 servings
Yaki Mandu,https://www.allrecipes.com/recipe/245124/yaki-mandu/,45,"Yaki mandu, a Korean dumpling filled with ground beef and vegetables, are a tasty appetizer to make for parties that everyone will love.","['1 pound ground beef', '1.5 cups vegetable oil for frying', '0.5 cup finely chopped green onions', '0.5 cup finely chopped cabbage', '0.5 cup finely chopped carrot', '0.5 cup minced garlic', '4 teaspoons sesame oil (divided)', '1 tablespoon toasted sesame seeds', ""0.5 teaspoon monosodium glutamate (such as Ac'cent®)"", 'salt and ground black pepper to taste', '2 eggs', '16 ounce package wonton wrappers', '3 tablespoons soy sauce', '2 teaspoons rice wine vinegar', '1 teaspoon toasted sesame seeds']","['Heat a large skillet over medium-high heat. Cook and stir beef in the hot skillet until browned and crumbly, 5 to 7 minutes; drain and discard grease.', 'Heat vegetable oil in a separate skillet over medium heat.', 'Mix green onions, cabbage, carrot, garlic, 1 tablespoon sesame oil, 1 tablespoon sesame seeds, monosodium glutamate, salt, and pepper into ground beef mixture; cook and stir until liquid is evaporated and vegetables are tender, 5 to 10 minutes. Transfer beef mixture to a bowl and mix in 1 egg.', 'Crack the second egg into a bowl and beat well.', 'Hold 1 wonton wrapper in the palm of your hand and brush a thin layer of beaten egg on 1 edge. Scoop about 1 teaspoon beef mixture into the center of the wrapper. Fold wrapper in half, corner to corner, to make a triangle and pinch the edges shut, crimping with your fingers to make a seal. Press the air out by cupping your fingers over the dumpling in your palm and pressing lightly.', 'Fry wontons in the hot oil until 1 side is browned, 2 to 3 minutes. Flip and cook until other side is browned, 2 to 3 minutes. Transfer wontons to a paper towel-lined plate to drain using a slotted spoon.', 'Whisk soy sauce, rice wine vinegar, 1 teaspoon sesame oil, and 1 teaspoon sesame seeds together in a bowl until dipping sauce is smooth. Serve alongside wontons.']",125 kcal,25 servings
Kimchi Jun (Kimchi Pancake) and Dipping Sauce,https://www.allrecipes.com/recipe/190241/kimchi-jun-kimchi-pancake-and-dipping-sauce/,30,"Korean-style spicy pancakes made of kimchi in an egg and flour batter, served with a snappy dipping sauce, are great for using overly-fermented kimchi.","['1 cup kimchi (drained) and chopped', '0.5 cup reserved juice from kimchi', '1 cup all-purpose flour', '2 eggs', '1 green onion (chopped)', '1 tablespoon vegetable oil', 'some pinched of salt', '1 tablespoon rice vinegar', '1 tablespoon soy sauce', '0.5 teaspoon sesame oil', '0.5 teaspoon Korean chili pepper flakes', '0.5 teaspoon toasted sesame seeds']","['Stir together the kimchi, kimchi juice, flour, eggs, and green onion in a bowl.', 'Heat vegetable oil over medium heat in a large skillet. Using about 1/4 cup of batter for each pancake, pour into skillet, spreading as thin as possible. Cook pancakes until set and lightly browned, turning once, 3 to 5 minutes per side. Season to taste with salt.', 'Whisk together the rice vinegar, soy sauce, sesame oil, chili pepper flakes, and toasted sesame seeds. Serve with the pancakes.']",199 kcal,4 servings
Tteokbokki (Korean Spicy Rice Cakes),https://www.allrecipes.com/recipe/265318/tteokbokki-korean-spicy-rice-cakes/,30,Korean street food is famous for flavor and this spicy tteokbokki doesn't disappoint: Chewy garaetteok (rice cakes) are cooked in chile paste and soy sauce.,"['3 cups water', '2 dried anchovies', '3 tablespoons chile paste', '2 tablespoons white sugar', '1 tablespoon soy sauce', '1 tablespoon corn syrup', '2 Korean fish cakes (sliced)', '0.5 onion, thickly sliced', '1 spring onion, thickly sliced']","['Combine water and anchovies in a saucepan and bring to a boil. Cook for 10 minutes. Remove anchovies.', 'Combine chile paste, sugar, soy sauce, and corn syrup in a bowl to make the sauce.', 'Add rice cakes and onion to the anchovy water in the saucepan. Add sauce. Bring to a boil and cook for 5 minutes, stirring occasionally. Add spring onion and boil 3 minutes more.']",183 kcal,2 servings
Japchae,https://www.allrecipes.com/recipe/236174/japchae/,45,"Japchae, a traditional Korean dish, made with sweet potato noodles, beef, and vegetables stir-fried in a sesame oil-based sauce is a delicious and colorful meal.","['3 tablespoons soy sauce', '2.5 tablespoons white sugar', '2 tablespoons sesame oil', '2 teaspoons minced garlic', '8 ounces sweet potato noodles', '4 ounces lean beef, cut into 2-inch long strips', '6 ounces fresh spinach', 'salt and ground black pepper to taste', '1 tablespoon vegetable oil (divided)', '1 small sweet onion (thinly sliced)', '4 mushrooms, stemmed and sliced', '1 small carrot, cut into matchsticks']","['Whisk soy sauce, sugar, sesame oil, and garlic in a bowl until sugar is dissolved into sauce.', 'Bring a large pot of lightly salted water to a boil. Cook sweet potato noodles in the boiling water, stirring occasionally until cooked through but firm to the bite, 6 to 7 minutes. Rinse noodles under cold water and drain. Transfer noodles to a bowl, add 2 tablespoons sauce, and toss to coat.', 'Squeeze beef under running water until juices run clear. Mix beef and 1 tablespoon sauce together in a bowl.', 'Bring a pot of water to a boil. Cook spinach in the boiling water until just wilted, about 1 minute. Drain quickly and transfer spinach to a bowl of cold water to stop the cooking process. Squeeze excess water from spinach, place spinach in a large bowl, and season with salt and pepper.', 'Heat 1 teaspoon oil in a large skillet over medium-high heat; cook onion until fragrant but crisp, 1 to 2 minutes. Transfer onion to the bowl with spinach. Heat another 1 teaspoon oil in the same skillet. Cook mushrooms in the hot oil until lightly browned but still firm, 1 to 2 minutes; add to onion mixture. Heat remaining 1 teaspoon oil in the same skillet. Cook carrot in the hot oil until lightly browned but still crisp, 1 to 2 minutes; add to onion mixture.', 'Cook and stir beef in the same skillet until browned, 1 to 2 minutes; add to onion mixture. Cook and stir noodles in the same skillet until heated through, 1 to 2 minutes; add to beef-onion mixture. Add remaining sauce to beef-noodles mixture and toss to coat using your hands.']",201 kcal,8 servings
Spicy Cabbage Kimchi,https://www.allrecipes.com/recipe/105179/spicy-cabbage-kimchi/,6180,"Use this spicy homemade kimchi in stir-fries, on burgers, as a side dish, or in your favorite Korean dishes.","['2 heads napa cabbage', '1.25 cups sea salt', '1 tablespoon fish sauce', '5 green onions (chopped)', '0.5 small white onion, minced', '2 cloves garlic, pressed', '2 tablespoons white sugar', '1 teaspoon ground ginger', '5 tablespoons Korean chile powder']","['Cut the cabbages in half lengthwise and trim the ends. Rinse and cut into pieces about 2 inch square. Place the cabbage into large resealable bags and sprinkle salt on the leaves so they are evenly coated. Use your hands to rub the salt in to the leaves. Seal the bags and leave at room temperature for 6 hours.', 'Rinse the salt from the cabbage leaves and then drain and squeeze out any excess liquid. Place the cabbage in a large container with a tight fitting lid. Stir in the fish sauce, green onions, white onion, garlic, sugar and ginger. Sprinkle the Korean chile powder over the mixture. Wear plastic gloves to protect your hands and rub the chile powder into the cabbage leaves until evenly coated. Seal the container and set in a cool dry place. Leave undisturbed for 4 days. Refrigerate before serving, and store in the refrigerator for up to 1 month (if it lasts that long!).']",12 kcal,56 servings
Korean Tofu and Vegetable Soup,https://www.allrecipes.com/recipe/55528/korean-tofu-and-vegetable-soup/,35,"This is the Korean equivalent of chicken noodle soup - it is a comforting, cure-all soup. It is also spicy and fresh, and easy to make.","['3 cups beef stock', '0.25 cup toenjang (fermented soybean paste)', '4 inch piece dashi kombu (dried kelp)', '5 cloves garlic (chopped)', '16 ounce package medium-firm tofu, cut into 1.5 x 1/4 inch dominoes', '1 pound napa cabbage, thickly sliced', '1 pound daikon radish cut into 1.5x1/4 inch pieces', '1 pound yellow squash, cut into 1.5x1/4 inch dominoes', '2 large green onions, white and pale green part only (sliced) diagonally into 1 1/4 inch pieces', '1 hot red pepper, seeded and sliced diagonally into 1/4 inch pieces']","['Pour the beef stock into a stock pot or large deep skillet over medium-high heat. Stir in the toenjang until dissolved. Add the kelp and garlic, and bring to a boil. Put in the tofu, cabbage, daikon and yellow squash, cover and return to a boil. Cook gently for 5 minutes. Then add the green onions and hot pepper, and boil for a minute, or until the onion and pepper become fragrant and brightly colored. Limit the cooking time to no more than 15 minutes. Remove and discard kelp. Serve immediately.']",289 kcal,4 servings
Korean Soft Tofu Stew (Soon Du Bu Jigae),https://www.allrecipes.com/recipe/151006/korean-soft-tofu-stew-soon-du-bu-jigae/,20,This versatile tofu stew is hearty and simple to make. Use more Korean chile powder for an added kick or toss in a few clams for an even more exotic treat.,"['1 teaspoon vegetable oil', '1 teaspoon Korean chile powder', '2 tablespoons ground beef', '1 tablespoon Korean soy bean paste (doenjang)', '1 cup water', 'some pinched of salt and pepper', '12 ounce package Korean soon tofu or soft tofu (drained) and sliced', '1 egg', '1 teaspoon sesame seeds', '1 green onion (chopped)']","['Heat the vegetable oil in a large saucepan over medium heat. Stir in the Korean chile powder and ground beef. Cook and stir until the beef is crumbly, evenly browned, and no longer pink. Stir in the soy bean paste, coating the beef. Pour in the water and bring to a boil. Season with salt and pepper. Gently drop tofu into the soup and continue cooking until the tofu is heated through, 1 to 2 minutes. Remove from heat and quickly add the egg into the soup, stirring gently to break it up. Garnish with sesame seeds and green onion.']",242 kcal,2 servings
Korean Spicy Chicken and Potato (Tak Toritang),https://www.allrecipes.com/recipe/88344/korean-spicy-chicken-and-potato-tak-toritang/,60,"A very easy meal to make! Chicken drumettes, potato, carrots, and onion simmer in a spicy sauce that goes best with white rice.","['2.5 pounds chicken drumettes', '2 large potatoes, cut into large chunks', '2 carrots, cut into 2 inch pieces', '1 large onion (cut into 8 pieces)', '4 cloves garlic, crushed', '0.25 cup water', '0.5 cup soy sauce', '2 tablespoons white sugar', '3 tablespoons gochujang (Korean hot pepper paste)']","['In a large pot over medium heat, mix the chicken, potatoes, carrots, onion, sugar, and garlic. Pour in water and soy sauce, and stir in sugar and hot pepper paste.', 'Bring to a boil, reduce heat to low, and simmer 45 minutes, until chicken juices run clear, vegetables are tender, and liquid has thickened.']",447 kcal,4 servings
Spicy Korean Chicken,https://www.allrecipes.com/recipe/262002/spicy-korean-chicken/,55,"Korean chicken thighs are slightly spicy and slightly sweet, marinated in a flavorful mixture of sesame oil, soy sauce, ginger, garlic, and Korean chile paste.","['2 tablespoons soy sauce', '2 tablespoons vegetable oil', '1.5 tablespoons Korean chile paste (gochujang)', '1 tablespoon sesame oil', '1 teaspoon Korean red chile flakes (gochugaru)', '3 cloves garlic, minced', '1 inch piece ginger (peeled and minced)', '1 pound skinless, boneless chicken thighs, pounded if desired']","['Combine soy sauce, vegetable oil, chile paste, sesame oil, chile flakes, garlic, and ginger in a large bowl; whisk until chile paste is completely dissolved. Add chicken and stir to coat. Cover with plastic wrap and refrigerate for at least 30 minutes or up to 2 hours.', 'Preheat an outdoor grill for medium heat and lightly oil the grate.', 'Grill chicken until slightly charred and no longer pink in the center, 5 to 8 minutes per side. An instant-read thermometer inserted into the center should read at least 165 degrees F (74 degrees C).']",257 kcal,4 servings
Korean Kimchi,https://www.allrecipes.com/recipe/107885/korean-kimchi/,3080,Napa cabbage is seasoned with crushed red pepper flakes and fermented in this traditional Korean pickle.,"['3 heads napa cabbage, cored and cut into quarters lengthwise', '0.5 cup salt', '3 heads garlic, minced', '1 bunch green onions, cut into 2 inch pieces', '1.5 tablespoons monosodium glutamate (MSG)', '2 teaspoons red pepper flakes']","['Cut the cabbage leaves into 2 inch long pieces. Spread 1/4 of the leaves into a large, non-metallic bowl and sprinkle with 1/4 of the salt. Repeat layering all of the cabbage has been salted. Let stand at room temperature until a lot of liquid has been pulled from the leaves and the cabbage is tender, 3 to 4 hours; drain. Rinse the cabbage in 2 or 3 changes of water. Drain again very well and return the cabbage to the mixing bowl.', 'Sprinkle the cabbage with the minced garlic, green onions, MSG, and red pepper flakes. Season to taste with additional salt and toss until evenly combined. Pack the mixture into a sterilized gallon-sized glass jar. Cover the jar with wax paper and a loose fitting lid so the seal is not airtight.', 'Allow the cabbage to ferment at room temperature until it reaches the desired degree of sourness, 2 to 5 days. Store in an airtight jar in the refrigerator.']",30 kcal,20 servings
Vegetarian Bibimbap,https://www.allrecipes.com/recipe/228241/vegetarian-bibimbap/,50,A vegetarian version of the Korean one-bowl meal of rice and vegetables topped with an egg is ready in less than an hour.,"['2 tablespoons sesame oil', '1 cup carrot matchsticks', '1 cup zucchini matchsticks', '0.5(14 ounce) can bean sprouts (drained)', '6 ounces canned bamboo shoots (drained)', '4.5 ounce can sliced mushrooms (drained)', '0.125 teaspoon salt to taste', '2 cups cooked and cooled rice', '0.35 cup sliced green onions', '2 tablespoons soy sauce', '0.25 teaspoon ground black pepper', '1 tablespoon butter', '3 eggs', '3 teaspoons sweet red chili sauce']","['Heat sesame oil in a large skillet over medium heat; cook and stir carrot and zucchini in the hot oil until vegetables begin to soften, about 5 minutes. Stir in bean sprouts, bamboo shoots, and mushrooms. Cook and stir until carrots are tender, about 5 more minutes. Season to taste with salt and set vegetables aside.', 'Stir cooked rice, green onions, soy sauce, and black pepper in the same skillet until the rice is hot. In a separate skillet over medium heat, melt butter and gently fry eggs, turning once, until the yolks are still slightly runny but the egg whites are firm, about 3 minutes per egg.', 'To serve, divide hot cooked rice mixture between 3 serving bowls and top each bowl with 1/3 of the vegetable mixture and a fried egg. Serve sweet red chili sauce on the side for mixing into bibimbap.']",395 kcal,3 servings
Ba'corn Cheese Corn,https://www.allrecipes.com/recipe/274640/bacorn-cheese-corn/,40,"Chef John lightens up this Korean bar food favorite but keeps the signature stringy, broiled cheesy top that makes this corn and bacon gratin so fun to eat.","['8 ounce package bacon (chopped)', '16 ounce packages frozen sweet corn, thawed', '4 cloves garlic, minced', '1 bunch green onions (sliced)', '2 jalapeno peppers (diced)', '1 pinch salt and freshly ground black pepper to taste', '1 pinch cayenne pepper', '1 cup heavy cream', '2 ounces shredded mozzarella cheese', '4 ounces shredded Monterey Jack cheese']","['Cook bacon in a 10-inch cast iron skillet over medium-high heat, stirring occasionally, until almost crisp and fat is rendered, 7 to 8 minutes.', ""Set an oven rack about 6 inches from the heat source and preheat the oven's broiler."", 'Drain frozen corn thoroughly in a colander. Add 1/2 of the corn to the skillet with the bacon. Cook and stir until kernels just start to turn golden brown, 3 to 5 minutes. Add garlic, green onions, and jalapenos; cook until vegetables start to soften and sweeten up, 3 to 4 minutes. Tilt pan to drain off some of the fat, using a paper towel to soak it up.', 'Season with salt, pepper, and cayenne. Pour in cream; stir and bring to a boil. Stir in the remaining corn until heated through. Turn off the heat and add about 2/3 of the mozzarella and Monterey Jack cheese. Stir to combine. Top corn with remaining cheese and a sprinkle of cayenne.', 'Broil until heated through and top is browned, 5 to 10 minutes. Serve immediately.']",268 kcal,10 servings
Godeungeo Jorim (Korean Braised Mackerel with Radish),https://www.allrecipes.com/recipe/246501/godeungeo-jorim-korean-braised-mackerel-with-radish/,55,Fresh mackerel and daikon radish are braised in a sweet and spicy sauce flavored with gochujang and gochugaru in this unique Korean recipe.,"['1 red chile pepper, seeded and minced', '1 green chile pepper, seeded and minced', '2 tablespoons cooking wine', '2 tablespoons gochugaru (Korean red pepper flakes)', '1 tablespoon gochujang (Korean chile paste)', '2 tablespoons soy sauce', '1 tablespoon brown sugar', '5 cloves garlic, minced', '0.5 teaspoon minced fresh ginger', '2 cups water', '1 daikon radish, halved lengthwise and sliced into 1/2-inch thick pieces', '2 whole mackerel - gutted, cleaned, and cut into 3-inch pieces', '2 green onions (sliced) on the bias into 1/2-inch pieces']","['Combine red chile pepper, green chile pepper, cooking wine, gochugaru, gochujang, soy sauce, brown sugar, garlic, and ginger in a small bowl; mix well to make sauce.', 'Place water and daikon radish in a large pot. Bring to a boil; cook until radish is tender, about 5 minutes.', 'Stir mackerel pieces into the pot. Pour sauce over the mackerel. Cook over high heat, occasionally spooning sauce over mackerel but not stirring the mixture, until cooking liquid has reduced by half, about 10 minutes. Reduce heat and simmer, partially covered, until sauce thickens, about 15 minutes.', 'Garnish mackerel with green onions.']",178 kcal,4 servings
Bulgogi (Korean Barbecued Beef),https://www.allrecipes.com/recipe/63911/bulgogi-korean-barbecued-beef/,200,"The flavorful marinade - made with soy sauce, sesame seeds and oil, garlic, and a little sugar - gives a unique flavor to beef and vegetables. Serve over white rice for a complete meal.","['3 tablespoons soy sauce', '1 tablespoon sesame oil', '1 tablespoon sesame seeds', '1 clove garlic, minced', '1 teaspoon white sugar', '0.5 teaspoon salt', '0.5 teaspoon ground black pepper', '0.25 teaspoon monosodium glutamate (MSG)', '1 pound beef top sirloin (thinly sliced)', '1 carrot, julienned', '1 green onion (chopped)', '0.5 yellow onion (chopped)']","['In a large resealable plastic bag, combine soy sauce, sesame oil, sesame seeds, garlic, sugar, salt, black pepper, and MSG. Place beef, carrots, and onions in the bag; seal, and shake to coat the vegetables and beef with the sauce. Refrigerate for at least 2 1/2 hours. I prefer to marinate mine overnight.', 'Preheat an outdoor grill for high heat. Remove meat and vegetables from marinade, and place on a large sheet of aluminum foil; seal. Discard marinade.', 'Place on grill, and cook for 15 to 20 minutes, or to desired doneness.']",243 kcal,4 servings
Fried Kimchi,https://www.allrecipes.com/recipe/221548/fried-kimchi/,20,"Kimchi is simply pan-fried with sesame oil, vinegar, and sugar in this Korean side dish that offers the perfect balance of sweet and sour!","['1 cup kimchi (chopped) into bite-sized pieces', '0.5 teaspoon sesame oil', '1.5 teaspoons white vinegar', '1 tablespoon white sugar']","['Heat a nonstick skillet to medium-high heat. Add kimchi. Saute until fragrant and slightly yellow, about 5 minutes. Add sesame oil; cook until kimchi is coated, 2 to 3 minutes. Pour in vinegar to coat the bottom of the skillet. Increase heat slightly; bring vinegar to a boil. Add sugar. Reduce heat to low; cook until sugar dissolves and kimchi is browned, about 3 minutes.']",25 kcal,4 servings
